{
  "case_id": "CASE-0010",
  "case_type": "withdrawal",
  "priority": "P1",
  "client_ref_present": true,
  "stated_deadline": null,
  "routing_queue": "intake_team",
  "missing_information": [],
  "needs_human_review": true,
  "review_reasons": [
    "irreversible_request"
  ],
  "summary": "[PERSON_1] asks to withdraw the claim entirely and stop contact. Irreversible; confirm directly with the claimant before actioning."
}
